{
  "id": "trigger-dev",
  "name": "Trigger.dev",
  "aliases": ["@trigger.dev/sdk", "triggerdev"],
  "category": "workflow-orchestration",
  "description": "Durable background job and workflow orchestration for production AI agents and event-driven apps. Provides step-by-step execution with retry logic, real-time observability, and webhook-triggered workflows. The default orchestration layer in production agent stacks.",
  "ecosystem_fit": [
    { "ecosystem": "solana", "strength": "strong", "notes": "Used in the solana-trading-agent workflow for durable agent execution with Helius webhook triggers." },
    { "ecosystem": "base", "strength": "strong", "notes": "Used in base-onchain-ai-agent for durable step execution." },
    { "ecosystem": "farcaster", "strength": "strong", "notes": "Farcaster social AI agents use Trigger.dev for durable response generation triggered by Neynar webhooks." },
    { "ecosystem": "ethereum", "strength": "strong", "notes": "General background job and orchestration use across Ethereum agent patterns." },
    { "ecosystem": "aptos", "strength": "limited" }
  ],
  "capabilities": [
    "background-jobs",
    "durable-step-execution",
    "retry-logic",
    "event-triggered-workflows",
    "real-time-logging",
    "step-visibility",
    "webhook-triggers",
    "scheduled-jobs",
    "fan-out-patterns",
    "concurrency-control"
  ],
  "workflow_positions": ["orchestration-layer"],
  "common_pairings": [
    {
      "tool_id": "helius",
      "relationship": "often-used-with",
      "context": "Helius webhooks trigger Trigger.dev jobs. The event-driven architecture for Solana agent workflows — Helius detects the onchain event, Trigger.dev executes the agent response durably.",
      "workflow_ref": "solana-trading-agent"
    },
    {
      "tool_id": "vercel-ai-sdk",
      "relationship": "often-used-with",
      "context": "Trigger.dev orchestrates the outer workflow (retries, step logging); Vercel AI SDK handles the LLM reasoning within each step.",
      "workflow_ref": "solana-trading-agent"
    },
    {
      "tool_id": "neynar",
      "relationship": "often-used-with",
      "context": "Neynar webhooks fire Trigger.dev jobs when Farcaster events occur. Trigger.dev provides the durable execution wrapper around agent social actions.",
      "workflow_ref": "farcaster-social-ai-agent"
    },
    {
      "tool_id": "alchemy-rpc",
      "relationship": "often-used-with",
      "context": "Alchemy webhooks trigger Trigger.dev jobs for EVM event-driven workflows on Base and Ethereum."
    }
  ],
  "trust_state": "production-grade",
  "trust_evidence": [
    {
      "tier": 1,
      "type": "recurring-workflow-pattern",
      "description": "Trigger.dev is cited as the default orchestration layer in every production AI agent workflow in WORKFLOWS.md. Appears in solana-trading-agent, base-onchain-ai-agent, and farcaster-social-ai-agent.",
      "verifiable": false
    },
    {
      "tier": 2,
      "type": "documentation-quality",
      "description": "Trigger.dev v3 maintains active documentation for background jobs, durable execution, and webhook-triggered workflows.",
      "source_url": "https://trigger.dev/docs",
      "verifiable": true
    },
    {
      "tier": 2,
      "type": "active-maintenance",
      "description": "Active development with v3 representing a significant architectural improvement over v2. Used in production by teams building AI-native applications.",
      "verifiable": false
    }
  ],
  "package_identifiers": {
    "npm": ["@trigger.dev/sdk", "@trigger.dev/nextjs", "@trigger.dev/react-hooks"]
  },
  "skill_refs": [],
  "workflow_refs": ["solana-trading-agent", "base-onchain-ai-agent", "farcaster-social-ai-agent"],
  "scale_guidance": {
    "hackathon": "Skip orchestration at hackathon scale. Use Trigger.dev from MVP onward.",
    "mvp": "Add Trigger.dev early — debugging autonomous agents without execution traces is extremely difficult. The visibility it provides pays for itself immediately.",
    "production": "Required for production agents. Production trading agents without durable orchestration will have unexplainable failures. Configure concurrency limits to prevent runaway agent executions."
  },
  "alternatives": [
    {
      "tool_id": "inngest",
      "when_to_prefer": "When simpler event-driven workflows are needed with less complex retry requirements. Inngest has a gentler learning curve and strong Next.js integration.",
      "ecosystem_context": "All EVM chains."
    },
    {
      "tool_id": "temporal",
      "when_to_prefer": "When very complex multi-step workflows require strong durable execution guarantees with fine-grained state management. Higher operational complexity than Trigger.dev.",
      "ecosystem_context": "All chains."
    }
  ],
  "anti_patterns": [
    "Using Trigger.dev v2 patterns with v3 — breaking changes in the SDK between versions. Check v3 migration guide.",
    "Skipping orchestration for production agents — autonomous agents without execution tracing will have failures that are impossible to debug.",
    "Not implementing concurrency limits — unconstrained agent workflows can exhaust LLM API quotas at machine speed."
  ],
  "retrieval_tags": ["background-jobs", "durable-execution", "workflow-orchestration", "webhooks", "retry-logic", "agent-orchestration"],
  "source": {
    "primary_url": "https://trigger.dev",
    "docs_url": "https://trigger.dev/docs",
    "github_url": "https://github.com/triggerdotdev/trigger.dev"
  },
  "updated_at": "2026-05-13"
}
